{
    "vasp_env": {
        "vasp_run_command": "mpirun -np 54 /trace/home/zefengc/soft/vasp.5.4.4.optcell/bin/vasp_ncl",
        "out_file_name": "slurm-vasp.out",
        "vasp_pp_path": "/trace/home/zefengc/soft/Pseudopotentials/",
        "dry_run": false,
        "dftu_only": false,
        "get_optimal_band": true
    },
    "bo": {
        "resume_checkpoint": false,
        "baseline": "hse",
        "which_u": [
            1,
            1
        ],
        "br": [
            5,
            5
        ],
        "kappa": 5,
        "alpha_gap": 0.25,
        "alpha_band": 0.75,
        "alpha_mag": 0.0,
        "threshold": 0.0001,
        "urange": [
            -10.0,
            10.0
        ],
        "elements": [
            "In",
            "As"
        ],
        "iteration": 200,
        "report_optimum_interval": 10
    },
    "structure_info": {
        "lattice_param": 6.0584,
        "cell": [
            [
                0.0,
                0.5,
                0.5
            ],
            [
                0.5,
                0.0,
                0.5
            ],
            [
                0.5,
                0.5,
                0.0
            ]
        ],
        "atoms": [
            [
                "In",
                [
                    0,
                    0,
                    0
                ],
                [
                    0,
                    0,
                    1e-06
                ]
            ],
            [
                "As",
                [
                    0.75,
                    0.75,
                    0.75
                ],
                [
                    0,
                    0,
                    1e-06
                ]
            ]
        ],
        "kgrid_hse": [
            7,
            7,
            7
        ],
        "kgrid_pbe": [
            7,
            7,
            7
        ],
        "num_kpts": 50,
        "kpath": "G X W L G K"
    },
    "general_flags": {
        "encut": 400,
        "sigma": 0.05,
        "ediff": 1e-05,
        "prec": "N",
        "algo": "D",
        "lsorbit": true,
        "saxis": [
            0,
            0,
            1
        ],
        "nbands": 21,
        "kpar": 6,
        "ncore": 3,
        "bmix": 3,
        "amin": 0.01,
        "lorbit": 11,
        "lmaxmix": 4
    },
    "scf": {
        "icharg": 2,
        "istart": 0,
        "xc": "pbe"
    },
    "band": {
        "icharg": 11,
        "lcharg": false,
        "lwave": false
    },
    "pbe": {
        "xc": "pbe",
        "ldau": true,
        "ldau_luj": {
            "In": {
                "L": 1,
                "U": 0.0,
                "J": 0.0
            },
            "As": {
                "L": 1,
                "U": 0.0,
                "J": 0.0
            }
        }

    },
    "hse": {
        "istart": 0,
        "icharg": 2,
        "xc": "hse06",
        "aexx": 0.25,
        "time": 0.4,
        "ldiag": true,
        "precfock": "Fast"
    }
}
